{
  "$schema": "https://json-schema.org/draft/2020-12/schema",
  "$id": "https://route-engine.example/schemas/university_config.schema.json",
  "title": "university_config",
  "description": "UniversityConfig — явный список подключаемых вузовских объектов. Папка вуза сама по себе не включает правила.",
  "type": "object",
  "properties": {
    "schema_version": {
      "enum": [
        "1.0.0",
        "1.1.0"
      ]
    },
    "id": {
      "type": "string",
      "pattern": "^UNIV_[A-Z0-9_]+$"
    },
    "name": {
      "type": "string",
      "minLength": 1
    },
    "status": {
      "enum": [
        "draft",
        "verified",
        "retired"
      ]
    },
    "timezone": {
      "type": "string",
      "minLength": 1
    },
    "contacts": {
      "type": "array",
      "items": {
        "type": "object",
        "properties": {
          "kind": {
            "enum": [
              "email",
              "phone",
              "url"
            ]
          },
          "value": {
            "type": "string",
            "minLength": 1
          },
          "label": {
            "type": "string",
            "minLength": 1
          }
        },
        "required": [
          "kind",
          "value",
          "label"
        ],
        "additionalProperties": false
      },
      "minItems": 0
    },
    "overlay_ids": {
      "type": "array",
      "items": {
        "type": "string",
        "pattern": "^OVR_[A-Z0-9_]+$"
      },
      "minItems": 0,
      "uniqueItems": true
    },
    "step_ids": {
      "type": "array",
      "items": {
        "type": "string",
        "pattern": "^UNI_[A-Z0-9_]+$"
      },
      "minItems": 0,
      "uniqueItems": true
    },
    "evidence": {
      "type": "array",
      "items": {
        "type": "object",
        "properties": {
          "source_id": {
            "type": "string",
            "pattern": "^SRC_[A-Z0-9_]+$"
          },
          "locator": {
            "type": "string",
            "minLength": 1
          },
          "supports": {
            "type": "string",
            "minLength": 1
          }
        },
        "required": [
          "source_id",
          "locator",
          "supports"
        ],
        "additionalProperties": false
      },
      "minItems": 0
    },
    "review": {
      "type": "object",
      "properties": {
        "reviewed_at": {
          "type": "string",
          "format": "date-time",
          "pattern": "^\\d{4}-\\d{2}-\\d{2}T\\d{2}:\\d{2}:\\d{2}(?:\\.\\d+)?(?:Z|[+-]\\d{2}:\\d{2})$"
        },
        "reviewer": {
          "type": "string",
          "minLength": 1
        },
        "next_review_on": {
          "type": "string",
          "format": "date"
        }
      },
      "required": [
        "reviewed_at",
        "reviewer",
        "next_review_on"
      ],
      "additionalProperties": false
    },
    "extension_resources": {
      "type": "object",
      "properties": {
        "facts": {
          "type": "string",
          "pattern": "^universities/UNIV_[A-Z0-9_]+/dictionaries/[a-z][a-z0-9_]*\\.json$"
        },
        "event_types": {
          "type": "string",
          "pattern": "^universities/UNIV_[A-Z0-9_]+/dictionaries/[a-z][a-z0-9_]*\\.json$"
        },
        "calendars": {
          "type": "string",
          "pattern": "^universities/UNIV_[A-Z0-9_]+/dictionaries/[a-z][a-z0-9_]*\\.json$"
        },
        "dictionaries": {
          "type": "array",
          "items": {
            "type": "string",
            "pattern": "^universities/UNIV_[A-Z0-9_]+/dictionaries/[a-z][a-z0-9_]*\\.json$"
          },
          "uniqueItems": true
        }
      },
      "required": [
        "facts",
        "event_types",
        "dictionaries"
      ],
      "additionalProperties": false
    }
  },
  "required": [
    "schema_version",
    "id",
    "name",
    "status",
    "timezone",
    "contacts",
    "overlay_ids",
    "step_ids",
    "evidence"
  ],
  "additionalProperties": false,
  "allOf": [
    {
      "if": {
        "properties": {
          "status": {
            "const": "verified"
          }
        }
      },
      "then": {
        "required": [
          "review"
        ],
        "properties": {
          "evidence": {
            "minItems": 1
          }
        }
      }
    },
    {
      "if": {
        "properties": {
          "schema_version": {
            "const": "1.1.0"
          }
        }
      },
      "then": {
        "required": [
          "extension_resources"
        ]
      },
      "else": {
        "not": {
          "required": [
            "extension_resources"
          ]
        }
      }
    }
  ]
}
