{
  "schema_version": "1.1.0",
  "id": "UNIV_SPBU",
  "name": "Санкт-Петербургский государственный университет",
  "status": "draft",
  "timezone": "Europe/Moscow",
  "contacts": [
    {
      "kind": "email",
      "value": "pvo@spbu.ru",
      "label": "УМиРР"
    }
  ],
  "overlay_ids": [
    "OVR_SPBU_INVITATION_REQUEST",
    "OVR_SPBU_HOST_DOCUMENTS",
    "OVR_SPBU_STUDY_VISA_EXTEND",
    "OVR_SPBU_STAY_PETITION_REQUEST",
    "OVR_SPBU_ACCOUNTING_DATA_UPDATE"
  ],
  "step_ids": [
    "UNI_SPBU_ARRIVAL_NOTIFY",
    "UNI_SPBU_PRIVATE_COPY",
    "UNI_SPBU_POLICY_COPY",
    "UNI_SPBU_TRAVEL_NOTIFY",
    "UNI_SPBU_DORM_ASSIGNMENT"
  ],
  "evidence": [
    {
      "source_id": "SRC_SPBU_GUIDE",
      "locator": "Название и локальная область источника",
      "supports": "Университет и назначение раздела."
    }
  ],
  "review": {
    "reviewed_at": "2026-09-26T11:34:43.776826Z",
    "reviewer": "Новое последовательное исследование официальных ресурсов",
    "next_review_on": "2026-10-26"
  },
  "extension_resources": {
    "facts": "universities/UNIV_SPBU/dictionaries/facts.json",
    "event_types": "universities/UNIV_SPBU/dictionaries/event_types.json",
    "dictionaries": [
      "universities/UNIV_SPBU/dictionaries/spbu_campuses.json"
    ]
  }
}
