{
  "schema_version": "1.1.0",
  "id": "UNIV_MIPT",
  "name": "МФТИ",
  "status": "draft",
  "timezone": "Europe/Moscow",
  "contacts": [],
  "overlay_ids": [
    "OVR_MIPT_INVITATION_REQUEST",
    "OVR_MIPT_HOST_DOCUMENTS",
    "OVR_MIPT_REGISTRATION_CONFIRMATION",
    "OVR_MIPT_STUDY_VISA_EXTEND",
    "OVR_MIPT_STUDY_VISA_COLLECT"
  ],
  "step_ids": [
    "UNI_MIPT_POLICY_COPY",
    "UNI_MIPT_FINGERPRINT_COPY",
    "UNI_MIPT_LEAVE_DORM",
    "UNI_MIPT_PASS"
  ],
  "evidence": [
    {
      "source_id": "SRC_MIPT_PK",
      "locator": "Название и локальная область источника",
      "supports": "Университет и назначение раздела."
    }
  ],
  "review": {
    "reviewed_at": "2026-09-26T08:43:03.629789Z",
    "reviewer": "Новое последовательное исследование официальных ресурсов",
    "next_review_on": "2026-10-26"
  },
  "extension_resources": {
    "facts": "universities/UNIV_MIPT/dictionaries/facts.json",
    "event_types": "universities/UNIV_MIPT/dictionaries/event_types.json",
    "dictionaries": [
      "universities/UNIV_MIPT/dictionaries/mipt_campuses.json"
    ]
  }
}
