{
  "schema_version": "1.1.0",
  "id": "UNIV_TSU",
  "name": "Национальный исследовательский Томский государственный университет",
  "status": "draft",
  "timezone": "Asia/Tomsk",
  "contacts": [
    {
      "kind": "email",
      "value": "visa@mail.tsu.ru",
      "label": "Визовое сопровождение"
    },
    {
      "kind": "phone",
      "value": "+7 (3822) 526-945",
      "label": "Визовое сопровождение"
    }
  ],
  "overlay_ids": [
    "OVR_TSU_INVITATION_REQUEST",
    "OVR_TSU_HOST_DOCUMENTS",
    "OVR_TSU_STUDY_VISA_EXTEND",
    "OVR_TSU_STAY_PETITION_REQUEST",
    "OVR_TSU_MEDICAL_INITIAL",
    "OVR_TSU_FINGERPRINT_PHOTO"
  ],
  "step_ids": [
    "UNI_TSU_TRAVEL_NOTIFY",
    "UNI_TSU_MEDICAL_COPY"
  ],
  "evidence": [
    {
      "source_id": "SRC_TSU_VISA",
      "locator": "Название и локальная область источника",
      "supports": "Университет и назначение раздела."
    }
  ],
  "review": {
    "reviewed_at": "2026-09-26T11:37:54.661491Z",
    "reviewer": "Новое последовательное исследование официальных ресурсов",
    "next_review_on": "2026-10-26"
  },
  "extension_resources": {
    "facts": "universities/UNIV_TSU/dictionaries/facts.json",
    "event_types": "universities/UNIV_TSU/dictionaries/event_types.json",
    "dictionaries": [
      "universities/UNIV_TSU/dictionaries/tsu_campuses.json"
    ]
  }
}
