{
  "schema_version": "1.1.0",
  "id": "UNIV_MEPHI",
  "name": "НИЯУ МИФИ",
  "status": "draft",
  "timezone": "Europe/Moscow",
  "contacts": [],
  "overlay_ids": [
    "OVR_MEPHI_INVITATION_DEGREE",
    "OVR_MEPHI_INVITATION_PREP",
    "OVR_MEPHI_HOST_DOCUMENTS",
    "OVR_MEPHI_REGISTRATION_CONFIRMATION",
    "OVR_MEPHI_STUDY_VISA_EXTEND",
    "OVR_MEPHI_STAY_PETITION_REQUEST",
    "OVR_MEPHI_ACCOUNTING_DATA_UPDATE",
    "OVR_MEPHI_REGISTRATION_DUPLICATE"
  ],
  "step_ids": [
    "UNI_MEPHI_PRIVATE_REG_COPY",
    "UNI_MEPHI_ARRIVAL_REQUEST"
  ],
  "evidence": [
    {
      "source_id": "SRC_MEPHI_STUD",
      "locator": "Название и локальная область источника",
      "supports": "Университет и назначение раздела."
    }
  ],
  "review": {
    "reviewed_at": "2026-09-26T08:40:44.639146Z",
    "reviewer": "Новое последовательное исследование официальных ресурсов",
    "next_review_on": "2026-10-26"
  },
  "extension_resources": {
    "facts": "universities/UNIV_MEPHI/dictionaries/facts.json",
    "event_types": "universities/UNIV_MEPHI/dictionaries/event_types.json",
    "dictionaries": [
      "universities/UNIV_MEPHI/dictionaries/mephi_campuses.json"
    ]
  }
}
